Šifra NKS;Puno ime NKS;Naziv NKS
G.3.6.1.10.;G.3.6.1.10. Asocijacija s vrstom Cystoseira crinita ;Asocijacija s vrstom Cystoseira crinita 
G.3.6.1.11.;G.3.6.1.11. Asocijacija s vrstom Sargassum vulgare ;Asocijacija s vrstom Sargassum vulgare 
G.3.6.1.12.;G.3.6.1.12. Asocijacija s vrstom Dictyopteris polypodioides ;Asocijacija s vrstom Dictyopteris polypodioides 
G.3.6.1.13.;G.3.6.1.13. Asocijacija s vrstom Colpomenia sinuosa ;Asocijacija s vrstom Colpomenia sinuosa 
G.3.6.1.14.;G.3.6.1.14. Asocijacija s vrstom Stypocaulon scoparium (=Halopteris scoparia);Asocijacija s vrstom Stypocaulon scoparium (=Halopteris scoparia)
G.3.6.1.15.;G.3.6.1.15. Asocijacija s vrstom Cystoseira compressa ;Asocijacija s vrstom Cystoseira compressa 
G.3.6.1.16.;G.3.6.1.16. Asocijacija s vrstama Pterocladiella capillacea i Ulva laetevirens ;Asocijacija s vrstama Pterocladiella capillacea i Ulva laetevirens 
G.3.6.1.17.;G.3.6.1.17. Facijes s velikim obrubnjacima;Facijes s velikim obrubnjacima
G.3.6.1.18.;G.3.6.1.18. Asocijacija s vrstama Flabellia petiolata i Peyssonnelia squamaria;Asocijacija s vrstama Flabellia petiolata i Peyssonnelia squamaria
G.3.6.1.19.;G.3.6.1.19. Asocijacija s vrstama Peyssonnelia rubra i Peyssonnelia spp.;Asocijacija s vrstama Peyssonnelia rubra i Peyssonnelia spp.
G.3.6.1.20.;G.3.6.1.20. Facijesi i asocijacije koraligenske biocenoze (kao enklave);Facijesi i asocijacije koraligenske biocenoze (kao enklave)
G.3.6.1.21.;G.3.6.1.21. Facijes s vrstom Chondrilla nucula ;Facijes s vrstom Chondrilla nucula 
G.3.7.;G.3.7. Infralitoral kraških morskih jezera;Infralitoral kraških morskih jezera
G.3.7.1.;G.3.7.1. Zajednice infralitorala kraških morskih jezera;Zajednice infralitorala kraških morskih jezera
G.3.7.1.1.;G.3.7.1.1. Zajednica infralitorala kraških morskih jezera;Zajednica infralitorala kraških morskih jezera
G.3.8.;G.3.8. Antropogena staništa u infralitoralu;Antropogena staništa u infralitoralu
G.3.8.1.;G.3.8.1. Antropogene infralitoralne zajednice na pomičnoj podlozi (mulju, pijesku, šljunku);Antropogene infralitoralne zajednice na pomičnoj podlozi (mulju, pijesku, šljunku)
G.3.8.1.1.;G.3.8.1.1. Infralitoralne zajednice dna turističkih plaža i ljekovitih blata;Infralitoralne zajednice dna turističkih plaža i ljekovitih blata
G.3.8.2.;G.3.8.2. Antropogene infralitoralne zajednice na čvrstoj podlozi;Antropogene infralitoralne zajednice na čvrstoj podlozi
G.3.8.2.1.;G.3.8.2.1. Zajednice infralitorala betoniranih i izgrađenih obala (luke, lučice, brodogradilišta) i ostalih ljudskih konstrukcija u moru (npr. plinske platforme) ;Zajednice infralitorala betoniranih i izgrađenih obala (luke, lučice, brodogradilišta) i ostalih ljudskih konstrukcija u moru (npr. plinske platforme) 
G.3.8.2.2.;G.3.8.2.2. Obraštajne zajednice na koritima brodova i brodica;Obraštajne zajednice na koritima brodova i brodica
G.3.8.2.3.;G.3.8.2.3. Degradirana biocenoza infralitoralnih algi;Degradirana biocenoza infralitoralnih algi
G.3.8.3.;G.3.8.3. Podmorska arheološka nalazišta;Podmorska arheološka nalazišta
G.3.8.3.1.;G.3.8.3.1. Podmorska arheološka nalazišta;Podmorska arheološka nalazišta
G.3.8.4.;G.3.8.4. Infralitoralne zajednice ispod marikulturnih zahvata;Infralitoralne zajednice ispod marikulturnih zahvata
G.3.8.4.1.;G.3.8.4.1. Uzgajališta riba;Uzgajališta riba
G.3.8.4.2.;G.3.8.4.2. Uzgajališta školjkaša;Uzgajališta školjkaša
G.3.8.4.3.;G.3.8.4.3. Obraštajne zajednice na instalacijama marikulture;Obraštajne zajednice na instalacijama marikulture
G.3.8.5.;G.3.8.5. Infralitoralne zajednice oko podmorskih ispusta otpadne vode;Infralitoralne zajednice oko podmorskih ispusta otpadne vode
G.3.8.5.1.;G.3.8.5.1. Infralitoralne zajednice oko podmorskih ispusta otpadne vode;Infralitoralne zajednice oko podmorskih ispusta otpadne vode
G.3.8.6.;G.3.8.6. Infralitoralne zajednice s invazivnim vrstama;Infralitoralne zajednice s invazivnim vrstama
G.3.8.6.1.;G.3.8.6.1. Zajednica s vrstom Caulerpa taxifolia;Zajednica s vrstom Caulerpa taxifolia
G.3.8.6.2.;G.3.8.6.2. Zajednica s vrstom Caulerpa racemosa;Zajednica s vrstom Caulerpa racemosa
G.4.;G.4. Cirkalitoral;Cirkalitoral
G.4.1.;G.4.1. Cirkalitoralni muljevi;Cirkalitoralni muljevi
G.4.1.1.;G.4.1.1. Biocenoza obalnih terigenih muljeva;Biocenoza obalnih terigenih muljeva
G.4.1.1.1.;G.4.1.1.1. Facijes mekanih muljeva s vrstom Turritella tricarinata communis;Facijes mekanih muljeva s vrstom Turritella tricarinata communis
G.4.1.1.2.;G.4.1.1.2. Facijes ljepljivih muljeva s vrstama Virgularia mirabilis i Pennatula phosphorea ;Facijes ljepljivih muljeva s vrstama Virgularia mirabilis i Pennatula phosphorea 
G.4.1.1.3.;G.4.1.1.3. Facijes ljepljivih muljeva s vrstama Alcyonium palmatum i Stichopus regalis ;Facijes ljepljivih muljeva s vrstama Alcyonium palmatum i Stichopus regalis 
G.4.1.2.;G.4.1.2. Biocenoza muljevitih dna otvorenog Jadrana i kanala sjevernog Jadrana;Biocenoza muljevitih dna otvorenog Jadrana i kanala sjevernog Jadrana
G.4.2.;G.4.2. Cirkalitoralni pijesci;Cirkalitoralni pijesci
G.4.2.1.;G.4.2.1. Biocenoza muljevitih detritusnih dna;Biocenoza muljevitih detritusnih dna
G.4.2.1.1.;G.4.2.1.1. Facijes s vrstom Ophiothrix quinquemaculata;Facijes s vrstom Ophiothrix quinquemaculata
G.4.2.1.2.;G.4.2.1.2. Facijes s vrstom Schizaster chiajei ;Facijes s vrstom Schizaster chiajei 
G.4.2.2.;G.4.2.2. Biocenoza obalnih detritusnih dna;Biocenoza obalnih detritusnih dna
G.4.2.2.1.;G.4.2.2.1. Asocijacija s rodolitima;Asocijacija s rodolitima
G.4.2.2.2.;G.4.2.2.2. Facijes maërla;Facijes maërla
G.4.2.2.3.;G.4.2.2.3. Asocijacija s vrstom Peyssonnelia rosa-marina ;Asocijacija s vrstom Peyssonnelia rosa-marina 
G.4.2.2.4.;G.4.2.2.4. Asocijacija s vrstom Laminaria rodriguezii;Asocijacija s vrstom Laminaria rodriguezii
G.4.2.2.5.;G.4.2.2.5. Facijes s vrstom Ophiura texturata ;Facijes s vrstom Ophiura texturata 
G.4.2.2.6.;G.4.2.2.6. Facijes sa sinascidijama;Facijes sa sinascidijama
G.4.2.2.7.;G.4.2.2.7. Facijes s velikim mahovnjacima;Facijes s velikim mahovnjacima
G.4.2.3.;G.4.2.3. Biocenoza detritusnog dna na rubu kontinentske podine;Biocenoza detritusnog dna na rubu kontinentske podine
G.4.2.3.1.;G.4.2.3.1. Facijes s vrstom Neolampas rostellata ;Facijes s vrstom Neolampas rostellata 
G.4.2.3.2.;G.4.2.3.2. Facijes s vrstom Leptometra phalangium ;Facijes s vrstom Leptometra phalangium 
G.4.2.4.;G.4.2.4. Biocenoza krupnih pijesaka i sitnih šljunaka pod utjecajem pridnenih struja (pojavljuje se i u infralitoralu);Biocenoza krupnih pijesaka i sitnih šljunaka pod utjecajem pridnenih struja (pojavljuje se i u infralitoralu)
G.4.2.4.1.;G.4.2.4.1. Biocenoza krupnih pijesaka i sitnih šljunaka pod utjecajem pridnenih struja (pojavljuje se i u infralitoralu);Biocenoza krupnih pijesaka i sitnih šljunaka pod utjecajem pridnenih struja (pojavljuje se i u infralitoralu)
G.4.2.5.;G.4.2.5. Biocenoza detritusnih dna otvorenog Jadrana;Biocenoza detritusnih dna otvorenog Jadrana
G.4.2.5.1.;G.4.2.5.1. Facijes s vrstom Atrina pectinata ;Facijes s vrstom Atrina pectinata 
G.4.2.5.2.;G.4.2.5.2. Facijes s vrstom Lytocarpia myriophyllum ;Facijes s vrstom Lytocarpia myriophyllum 
G.4.3.;G.4.3. Cirkalitoralna čvrsta dna i stijene;Cirkalitoralna čvrsta dna i stijene
G.4.3.1.;G.4.3.1. Koraligenska biocenoza;Koraligenska biocenoza
G.4.3.1.1.;G.4.3.1.1. Asocijacija s vrstom Cystoseira corniculata ;Asocijacija s vrstom Cystoseira corniculata 
G.4.3.1.2.;G.4.3.1.2. Asocijacija s autohtonim vrstama roda Sargassum ;Asocijacija s autohtonim vrstama roda Sargassum 
G.4.3.1.3.;G.4.3.1.3. Asocijacija s vrstom Mesophyllum lichenoides ;Asocijacija s vrstom Mesophyllum lichenoides 
G.4.3.1.4.;G.4.3.1.4. Asocijacija s vrstama Lithophyllum frondosum i Halimeda tuna;Asocijacija s vrstama Lithophyllum frondosum i Halimeda tuna
G.4.3.1.5.;G.4.3.1.5. Facijes s vrstom Eunicella cavolinii ;Facijes s vrstom Eunicella cavolinii 
G.4.3.1.6.;G.4.3.1.6. Facijes s vrstom Eunicella singularis ;Facijes s vrstom Eunicella singularis 
G.4.3.1.7.;G.4.3.1.7. Facijes s vrstom Lophogorgia sarmentosa ;Facijes s vrstom Lophogorgia sarmentosa 
G.4.3.1.8.;G.4.3.1.8. Facijes s vrstom Paramuricea clavata;Facijes s vrstom Paramuricea clavata
G.4.3.1.9.;G.4.3.1.9. Facijes s vrstom Parazoanthus axinellae ;Facijes s vrstom Parazoanthus axinellae 
G.4.3.1.10.;G.4.3.1.10. Koraligenske platforme;Koraligenske platforme
G.4.3.2.;G.4.3.2. Biocenoza polutamnih špilja (pojavljuje se i kao enklava u infralitoralu);Biocenoza polutamnih špilja (pojavljuje se i kao enklava u infralitoralu)
G.4.3.2.1.;G.4.3.2.1. Facijes s vrstom Parazoanthus axinellae ;Facijes s vrstom Parazoanthus axinellae 
G.4.3.2.2.;G.4.3.2.2. Facijes s vrstom Corallium rubrum;Facijes s vrstom Corallium rubrum
G.4.3.2.3.;G.4.3.2.3. Facijes s vrstom Leptopsammia pruvoti;Facijes s vrstom Leptopsammia pruvoti
G.4.3.3.;G.4.3.3. Biocenoza potpučinskih stijena (stijena na rubu kontinentske podine);Biocenoza potpučinskih stijena (stijena na rubu kontinentske podine)
G.4.3.3.1.;G.4.3.3.1. Biocenoza potpučinskih stijena (stijena na rubu kontinentske podine);Biocenoza potpučinskih stijena (stijena na rubu kontinentske podine)
G.4.3.4.;G.4.3.4. Biocenoza vrulja ponorskog tipa;Biocenoza vrulja ponorskog tipa
G.4.3.4.1.;G.4.3.4.1. Biocenoza vrulja ponorskog tipa;Biocenoza vrulja ponorskog tipa
G.4.4.;G.4.4. Cirkalitoral kraških morskih jezera;Cirkalitoral kraških morskih jezera
G.4.4.1.;G.4.4.1. Zajednice cirkalitorala kraških morskih jezera;Zajednice cirkalitorala kraških morskih jezera
G.4.4.1.1.;G.4.4.1.1. Zajednica cirkalitorala kraških morskih jezera;Zajednica cirkalitorala kraških morskih jezera
G.4.5.;G.4.5. Antropogena staništa u cirkalitoralu;Antropogena staništa u cirkalitoralu
G.4.5.1.;G.4.5.1. Antropogene cirkalitoralne zajednice na dnima unutar luka i brodogradilišta;Antropogene cirkalitoralne zajednice na dnima unutar luka i brodogradilišta
G.4.5.1.1.;G.4.5.1.1. Dna morskih luka;Dna morskih luka
G.4.5.1.2.;G.4.5.1.2. Dna brodogradilišta;Dna brodogradilišta
G.4.5.2.;G.4.5.2. Podmorska arheološka nalazišta;Podmorska arheološka nalazišta
G.4.5.2.1.;G.4.5.2.1. Podmorska arheološka nalazišta;Podmorska arheološka nalazišta
G.4.5.3.;G.4.5.3. Kočarska dna;Kočarska dna
G.4.5.3.1.;G.4.5.3.1. Muljevita kočarska dna;Muljevita kočarska dna
G.4.5.3.2.;G.4.5.3.2. Detritusna (pjeskovita) kočarska dna;Detritusna (pjeskovita) kočarska dna
G.4.5.4.;G.4.5.4. Cirkalitoralne zajednice ispod marikulturnih zahvata;Cirkalitoralne zajednice ispod marikulturnih zahvata
G.4.5.4.1.;G.4.5.4.1. Uzgajališta riba;Uzgajališta riba
G.4.5.5.;G.4.5.5. Cirkalitoralne zajednice oko podmorskih ispusta otpadne vode;Cirkalitoralne zajednice oko podmorskih ispusta otpadne vode
G.4.5.5.1.;G.4.5.5.1. Cirkalitoralne zajednice oko podmorskih ispusta otpadne vode;Cirkalitoralne zajednice oko podmorskih ispusta otpadne vode
G.4.5.6.;G.4.5.6. Cirkalitoralne zajednice s invazivnim vrstama;Cirkalitoralne zajednice s invazivnim vrstama
G.4.5.6.1.;G.4.5.6.1. Zajednica s vrstom Caulerpa taxifolia;Zajednica s vrstom Caulerpa taxifolia
G.4.5.6.2.;G.4.5.6.2. Zajednica s vrstom Caulerpa racemosa;Zajednica s vrstom Caulerpa racemosa
G.5.;G.5. Batijal;Batijal
G.5.1.;G.5.1. Batijalni muljevi;Batijalni muljevi
G.5.1.1.;G.5.1.1. Biocenoza batijalnih muljeva;Biocenoza batijalnih muljeva
G.5.1.1.1.;G.5.1.1.1. Facijes pjeskovitih muljeva s vrstom Thenea muricata ;Facijes pjeskovitih muljeva s vrstom Thenea muricata 
G.5.1.1.2.;G.5.1.1.2. Facijes tekućih muljeva s vrstom Brissopsis lyrifera ;Facijes tekućih muljeva s vrstom Brissopsis lyrifera 
G.5.1.1.3.;G.5.1.1.3. Facijes mekanih muljeva s vrstama Funiculina quadrangularis i Apporhais seressianus ;Facijes mekanih muljeva s vrstama Funiculina quadrangularis i Apporhais seressianus 
G.5.1.1.4.;G.5.1.1.4. Facijes tvrdih muljeva s vrstom Isidella elongata ;Facijes tvrdih muljeva s vrstom Isidella elongata 
G.5.1.1.5.;G.5.1.1.5. Facijes s vrstom Pheronema grayi ;Facijes s vrstom Pheronema grayi 
G.5.2.;G.5.2. Batijalni pijesci;Batijalni pijesci
G.5.2.1.;G.5.2.1. Biocenoza batijalnih detritusnih pijesaka s vrstom Grypheus vitreus ;Biocenoza batijalnih detritusnih pijesaka s vrstom Grypheus vitreus 
G.5.2.1.1.;G.5.2.1.1. Biocenoza batijalnih detritusnih pijesaka s vrstom Grypheus vitreus ;Biocenoza batijalnih detritusnih pijesaka s vrstom Grypheus vitreus 
G.5.3.;G.5.3. Batijalno čvrsto dno i stijene;Batijalno čvrsto dno i stijene
G.5.3.1.;G.5.3.1. Biocenoza dubinskih koralja;Biocenoza dubinskih koralja
G.5.3.1.1.;G.5.3.1.1. Biocenoza dubinskih koralja;Biocenoza dubinskih koralja
G.5.3.2.;G.5.3.2. Biocenoza špilja i prolaza u potpunoj tami (javlja se i kao enklava u plićim stepenicama);Biocenoza špilja i prolaza u potpunoj tami (javlja se i kao enklava u plićim stepenicama)
G.5.3.2.1.;G.5.3.2.1. Biocenoza špilja i prolaza u potpunoj tami (javlja se i kao enklava u plićim stepenicama);Biocenoza špilja i prolaza u potpunoj tami (javlja se i kao enklava u plićim stepenicama)
H.;H. Podzemlje;Podzemlje
H.1.;H.1. Kraške špilje i jame;Kraške špilje i jame
H.1.1.;H.1.1. Kopnena kraška špiljska staništa;Kopnena kraška špiljska staništa
H.1.1.1.;H.1.1.1. Polušpilje i ulazni (osvijetljeni) dijelovi špilja;Polušpilje i ulazni (osvijetljeni) dijelovi špilja
H.1.1.1.1.;H.1.1.1.1. Špilje sa subtroglofilnim beskralješnjacima;Špilje sa subtroglofilnim beskralješnjacima
H.1.1.2.;H.1.1.2. Suhe fosilne špilje;Suhe fosilne špilje
H.1.1.2.1.;H.1.1.2.1. Suhe fosilne špilje;Suhe fosilne špilje
H.1.1.3.;H.1.1.3. Špilje i špiljski sustavi sa subtroglofilnim kralješnjacima;Špilje i špiljski sustavi sa subtroglofilnim kralješnjacima
H.1.1.3.1.;H.1.1.3.1. Kontinentalne špilje sa subtroglofilnim kralješnjacima;Kontinentalne špilje sa subtroglofilnim kralješnjacima
H.1.1.3.2.;H.1.1.3.2. Otočne špilje sa subtroglofilnim kralješnjacima;Otočne špilje sa subtroglofilnim kralješnjacima
H.1.1.4.;H.1.1.4. Špilje i špiljski sustavi s troglobiontskim beskralješnjacima;Špilje i špiljski sustavi s troglobiontskim beskralješnjacima
H.1.1.4.1.;H.1.1.4.1. Špilje umjerenih uvjeta s troglobiontskim beskralješnjacima;Špilje umjerenih uvjeta s troglobiontskim beskralješnjacima
H.1.1.4.2.;H.1.1.4.2. Ledene špilje s troglobiontima;Ledene špilje s troglobiontima
H.1.1.5.;H.1.1.5. Špilje s troglofilnim beskralješnjacima;Špilje s troglofilnim beskralješnjacima
H.1.1.5.1.;H.1.1.5.1. Špilje s troglofilnim beskralješnjacima;Špilje s troglofilnim beskralješnjacima
H.1.1.6.;H.1.1.6. Atroglozoocenotičke špilje;Atroglozoocenotičke špilje
H.1.1.6.1.;H.1.1.6.1. Atroglozoocenotičke špilje;Atroglozoocenotičke špilje
H.1.2.;H.1.2. Amfibijska kraška špiljska staništa;Amfibijska kraška špiljska staništa
H.1.2.1.;H.1.2.1. Amfibijska kraška špiljska staništa;Amfibijska kraška špiljska staništa
H.1.2.1.1.;H.1.2.1.1. Higropetrik;Higropetrik
H.1.2.1.2.;H.1.2.1.2. Marifugijske naslage;Marifugijske naslage
H.1.3.;H.1.3. Vodena (slatkodovna) kraška špiljska staništa;Vodena (slatkodovna) kraška špiljska staništa
H.1.3.1.;H.1.3.1. Podzemne tekućice;Podzemne tekućice
H.1.3.1.1.;H.1.3.1.1. Podzemni brzaci;Podzemni brzaci
H.1.3.1.2.;H.1.3.1.2. Endogene podzemne rijeke;Endogene podzemne rijeke
H.1.3.1.3.;H.1.3.1.3. Egzogene podzemne rijeke;Egzogene podzemne rijeke
H.1.3.2.;H.1.3.2. Podzemne stajaćice;Podzemne stajaćice
H.1.3.2.1.;H.1.3.2.1. Podzemna jezera;Podzemna jezera
H.1.3.2.2.;H.1.3.2.2. Kamenice;Kamenice
H.1.3.2.3.;H.1.3.2.3. Lokve;Lokve
H.1.4.;H.1.4. Anhihaline kraške špilje;Anhihaline kraške špilje
H.1.4.1.;H.1.4.1. Anhihaline kraške špilje;Anhihaline kraške špilje
H.1.4.1.1.;H.1.4.1.1. Anhihaline kraške špilje;Anhihaline kraške špilje
H.1.5.;H.1.5. Zasumporene kraške špilje;Zasumporene kraške špilje
H.1.5.1.;H.1.5.1. Hidrotermalne zasumporene špilje;Hidrotermalne zasumporene špilje
H.1.5.1.1.;H.1.5.1.1. Hidrotermalne zasumporene špilje;Hidrotermalne zasumporene špilje
H.2.;H.2. Nekraške špilje i jame;Nekraške špilje i jame
H.2.1.;H.2.1. Nekraške špilje i jame;Nekraške špilje i jame
H.2.1.1.;H.2.1.1. Špilje i jame u flišu;Špilje i jame u flišu
H.2.1.1.1.;H.2.1.1.1. Špilje i jame u flišu;Špilje i jame u flišu
H.2.1.2.;H.2.1.2. Špilje i jame u laporu;Špilje i jame u laporu
H.2.1.2.1.;H.2.1.2.1. Špilje i jame u laporu;Špilje i jame u laporu
H.3.;H.3. Intersticijska podzemna staništa;Intersticijska podzemna staništa
H.3.1.;H.3.1. Intersticijska kopnena staništa;Intersticijska kopnena staništa
H.3.1.1.;H.3.1.1. Intersticijska kopnena staništa;Intersticijska kopnena staništa
H.3.1.1.1.;H.3.1.1.1. Površinsko kopneno intersticijsko stanište (MSS – milieu souterrain superficiel);Površinsko kopneno intersticijsko stanište (MSS – milieu souterrain superficiel)
H.3.1.1.2.;H.3.1.1.2. Pukotine stijena;Pukotine stijena
H.3.2.;H.3.2. Intersticijska vodena staništa;Intersticijska vodena staništa
H.3.2.1.;H.3.2.1. Intersticijska vodena staništa;Intersticijska vodena staništa
H.3.2.1.1.;H.3.2.1.1. Freatička zona;Freatička zona
H.3.2.1.2.;H.3.2.1.2. Hiporeička zona;Hiporeička zona
H.3.2.1.3.;H.3.2.1.3. Hipotelminoreička zona;Hipotelminoreička zona
H.3.2.1.4.;H.3.2.1.4. Psamolitoral;Psamolitoral
H.4.;H.4. Antropogena podzemna staništa;Antropogena podzemna staništa
H.4.1.;H.4.1. Antropogena kopnena podzemna staništa;Antropogena kopnena podzemna staništa
H.4.1.1.;H.4.1.1. Rudnici i podzemni prolazi;Rudnici i podzemni prolazi
H.4.1.1.1.;H.4.1.1.1. Aktivni rudnici i podzemni prolazi;Aktivni rudnici i podzemni prolazi
H.4.1.1.2.;H.4.1.1.2. Napušteni rudnici i podzemni prolazi;Napušteni rudnici i podzemni prolazi
H.4.2.;H.4.2. Antropogena vodena podzemna staništa;Antropogena vodena podzemna staništa
H.4.2.1.;H.4.2.1. Podzemne antropogene akumulacije;Podzemne antropogene akumulacije
H.4.2.1.1.;H.4.2.1.1. Podzemne antropogene akumulacije;Podzemne antropogene akumulacije
H.4.2.2.;H.4.2.2. Podzemni antropogeni vodotoci;Podzemni antropogeni vodotoci
H.4.2.2.1.;H.4.2.2.1. Podzemni antropogeni vodotoci;Podzemni antropogeni vodotoci
I.;I. Kultivirane nešumske površine i staništa s korovnom i ruderalnom vegetacijom;Kultivirane nešumske površine i staništa s korovnom i ruderalnom vegetacijom
I.1.;I.1. Površine obrasle korovnom i ruderalnom vegetacijom;Površine obrasle korovnom i ruderalnom vegetacijom
I.1.1.;I.1.1. Pukotine starih zidova;Pukotine starih zidova
I.1.1.1.;I.1.1.1. Pukotine starih zidova hrvatskog primorja;Pukotine starih zidova hrvatskog primorja
I.1.1.1.1.;I.1.1.1.1. Zajednica smeđe slezenice i mesnatog klobučića;Zajednica smeđe slezenice i mesnatog klobučića
I.1.2.;I.1.2. Korovna i ruderalna vegetacija Sredozemlja;Korovna i ruderalna vegetacija Sredozemlja
I.1.2.1.;I.1.2.1. Okopavinski korovi primorskih krajeva;Okopavinski korovi primorskih krajeva
I.1.2.1.1.;I.1.2.1.1. Zajednica vršače sljezolike i divljeg sirka;Zajednica vršače sljezolike i divljeg sirka
I.1.2.1.2.;I.1.2.1.2. Zajednica babjeg zuba i šćira;Zajednica babjeg zuba i šćira
I.1.2.1.3.;I.1.2.1.3. Zajednica sitnocvjetne dimovice i gomoljastog oštrika;Zajednica sitnocvjetne dimovice i gomoljastog oštrika
I.1.2.1.4.;I.1.2.1.4. Zajednica kovrčave hudoljetnice i trnovite dikice;Zajednica kovrčave hudoljetnice i trnovite dikice
I.1.2.1.5.;I.1.2.1.5. Zajednica repate i kuglaste koprive;Zajednica repate i kuglaste koprive
I.1.2.1.6.;I.1.2.1.6. Zajednica sitnoglavičastog strička i običnog osloboda;Zajednica sitnoglavičastog strička i običnog osloboda
I.1.2.1.7.;I.1.2.1.7. Zajednica obične koprive i velike crkvine;Zajednica obične koprive i velike crkvine
I.1.2.1.8.;I.1.2.1.8. Zajednica drvolike stole;Zajednica drvolike stole
I.1.2.1.9.;I.1.2.1.9. Zajednica lobode kamenjarke;Zajednica lobode kamenjarke
I.1.2.2.;I.1.2.2. Primorske utrine;Primorske utrine
I.1.2.2.1.;I.1.2.2.1. Zajednica primorskog divljeg ječma;Zajednica primorskog divljeg ječma
I.1.2.2.2.;I.1.2.2.2. Zajednica sikaline i bijele marulje (tetrljana);Zajednica sikaline i bijele marulje (tetrljana)
I.1.3.;I.1.3. Utrine kontinentalnih, rjeđe primorskih krajeva;Utrine kontinentalnih, rjeđe primorskih krajeva
I.1.3.1.;I.1.3.1. Utrine kontinentalnih, rjeđe primorskih krajeva;Utrine kontinentalnih, rjeđe primorskih krajeva
I.1.3.1.1.;I.1.3.1.1. Utrine ljulja utrinca i busenastog trpuca;Utrine ljulja utrinca i busenastog trpuca
I.1.3.1.2.;I.1.3.1.2. Utrina puzave odre i tvrdike;Utrina puzave odre i tvrdike
I.1.3.1.3.;I.1.3.1.3. Utrina tvrdike i ptičjeg dvornika;Utrina tvrdike i ptičjeg dvornika
I.1.3.1.4.;I.1.3.1.4. Utrine ljulja utrinca i velikog trpuca;Utrine ljulja utrinca i velikog trpuca
I.1.3.1.5.;I.1.3.1.5. Utrine ljulja utrinca i prilegle djeteline;Utrine ljulja utrinca i prilegle djeteline
I.1.3.1.6.;I.1.3.1.6. Zajednica kamilice i ptičjeg dvornika;Zajednica kamilice i ptičjeg dvornika
I.1.3.1.7.;I.1.3.1.7. Zajednica puzave odre i ptičjeg dvornika;Zajednica puzave odre i ptičjeg dvornika
I.1.4.;I.1.4. Ruderalne zajednice kontinentalnih krajeva;Ruderalne zajednice kontinentalnih krajeva
I.1.4.1.;I.1.4.1. Zajednice s običnom bodljačom;Zajednice s običnom bodljačom
I.1.4.1.1.;I.1.4.1.1. Zajednica obične bodljače;Zajednica obične bodljače
I.1.4.2.;I.1.4.2. Zajednice s mrkvom i kokotcem;Zajednice s mrkvom i kokotcem
I.1.4.2.1.;I.1.4.2.1. Zajednica obične lisičine i kokotacâ;Zajednica obične lisičine i kokotacâ
I.1.4.2.2.;I.1.4.2.2. Zajednica običnog vratića i običnog pelina;Zajednica običnog vratića i običnog pelina
I.1.4.3.;I.1.4.3. Zajednice s velikim čičkom;Zajednice s velikim čičkom
I.1.4.3.1.;I.1.4.3.1. Zajednica prave srčenice i crnoglavca;Zajednica prave srčenice i crnoglavca
I.1.4.3.2.;I.1.4.3.2. Zajednica čičaka i običnog pelina;Zajednica čičaka i običnog pelina
I.1.5.;I.1.5. Nitrofilna, skiofilna ruderalna vegetacija;Nitrofilna, skiofilna ruderalna vegetacija
I.1.5.1.;I.1.5.1. Zajednice s broćikom i češnjačom;Zajednice s broćikom i češnjačom
I.1.5.1.1.;I.1.5.1.1. Zajednica lukovičaste krabljice;Zajednica lukovičaste krabljice
I.1.5.1.2.;I.1.5.1.2. Zajednica abdovine;Zajednica abdovine
I.1.5.1.3.;I.1.5.1.3. Zajednica češnjače i njišuće krabljice;Zajednica češnjače i njišuće krabljice
I.1.5.1.4.;I.1.5.1.4. Zajednica trepavičaste krasuljice;Zajednica trepavičaste krasuljice
I.1.5.1.5.;I.1.5.1.5. Zajednica obične četinjavke;Zajednica obične četinjavke
I.1.5.1.6.;I.1.5.1.6. Zajednica trokutolisne lobode;Zajednica trokutolisne lobode
I.1.5.2.;I.1.5.2. Zajednice s jarčevcem;Zajednice s jarčevcem
I.1.5.2.1.;I.1.5.2.1. Zajednica zlatne krabljice;Zajednica zlatne krabljice
I.1.5.2.2.;I.1.5.2.2. Zajednica obične koprive i podagrastog jarčevca;Zajednica obične koprive i podagrastog jarčevca
I.1.5.3.;I.1.5.3. Zajednice s netekom i šumskim čistacem;Zajednice s netekom i šumskim čistacem
I.1.5.3.1.;I.1.5.3.1. Zajednica gorske vrbolike i pastirske iglice;Zajednica gorske vrbolike i pastirske iglice
I.1.5.3.2.;I.1.5.3.2. Zajednica dlakave češljugovine;Zajednica dlakave češljugovine
I.1.5.3.3.;I.1.5.3.3. Zajednica čvoraste mjehurnjače i sjajne iglice;Zajednica čvoraste mjehurnjače i sjajne iglice
I.1.5.4.;I.1.5.4. Zajednice ladoleža uz riječne tokove;Zajednice ladoleža uz riječne tokove
I.1.5.4.1.;I.1.5.4.1. Zajednica žljezdastog nedirka i zlatnicâ;Zajednica žljezdastog nedirka i zlatnicâ
I.1.5.4.2.;I.1.5.4.2. Zajednica kasne i kanadske zlatnice;Zajednica kasne i kanadske zlatnice
I.1.5.4.3.;I.1.5.4.3. Zajednica kasne zlatnice i ljepljive kadulje;Zajednica kasne zlatnice i ljepljive kadulje
I.1.5.4.4.;I.1.5.4.4. Zajednica ježinca;Zajednica ježinca
I.1.5.4.5.;I.1.5.4.5. Zajednica bodljastog sladića;Zajednica bodljastog sladića
I.1.5.5.;I.1.5.5. Sjenovite zajednice lopuha;Sjenovite zajednice lopuha
I.1.5.5.1.;I.1.5.5.1. Sjenovite zajednice lopuha;Sjenovite zajednice lopuha
I.1.6.;I.1.6. Korovi srednje Europe;Korovi srednje Europe
I.1.6.1.;I.1.6.1. Korovi strnih žitarica;Korovi strnih žitarica
I.1.6.1.1.;I.1.6.1.1. Korovi strnih žitarica;Korovi strnih žitarica
I.1.6.2.;I.1.6.2. Okopavinski korovi;Okopavinski korovi
I.1.6.2.1.;I.1.6.2.1. Zajednica streličaste kiselice i jednogodišnje treskavice;Zajednica streličaste kiselice i jednogodišnje treskavice
I.1.6.2.2.;I.1.6.2.2. Zajednica zečje soce i višesjemene lobode;Zajednica zečje soce i višesjemene lobode
I.1.6.2.3.;I.1.6.2.3. Zajednica koštreve i sitnocvjetne konice;Zajednica koštreve i sitnocvjetne konice
I.1.6.2.4.;I.1.6.2.4. Zajednica plavičastog muhara i sitnocvjetne konice;Zajednica plavičastog muhara i sitnocvjetne konice
I.1.6.3.;I.1.6.3. Korovne zajednice s kosmatkom;Korovne zajednice s kosmatkom
I.1.6.3.1.;I.1.6.3.1. Zajednica mjehuraste sljezovke i mnogocvjetne kosmatke;Zajednica mjehuraste sljezovke i mnogocvjetne kosmatke
I.1.6.4.;I.1.6.4. Korovne zajednice s oranjem;Korovne zajednice s oranjem
I.1.6.4.1.;I.1.6.4.1. Utrina divljeg ječma;Utrina divljeg ječma
I.1.6.4.2.;I.1.6.4.2. Zajednica sićušnog sljeza;Zajednica sićušnog sljeza
I.1.6.4.3.;I.1.6.4.3. Zajednica korovnog sljeza s koprivom;Zajednica korovnog sljeza s koprivom
I.1.7.;I.1.7. Zajednice nitrofilnih, higrofilnih i skiofilnih staništa;Zajednice nitrofilnih, higrofilnih i skiofilnih staništa
I.1.7.1.;I.1.7.1. Zajednice s trodjelnim dvozubom;Zajednice s trodjelnim dvozubom
I.1.7.1.1.;I.1.7.1.1. Zajednica vodenog papra i todjelnog dvozuba;Zajednica vodenog papra i todjelnog dvozuba
I.1.7.1.2.;I.1.7.1.2. Zajednica blijedožutog žabnjaka;Zajednica blijedožutog žabnjaka
I.1.7.1.3.;I.1.7.1.3. Zajednica crvenožutog repka s kiselicom;Zajednica crvenožutog repka s kiselicom
I.1.7.1.4.;I.1.7.1.4. Zajednica obalne dikice;Zajednica obalne dikice
I.1.8.;I.1.8. Zapuštene poljoprivredne površine;Zapuštene poljoprivredne površine
I.1.8.1.;I.1.8.1. Zapuštene poljoprivredne površine zarasle zeljastom vegetacijom;Zapuštene poljoprivredne površine zarasle zeljastom vegetacijom
